{
  "name": "figma",
  "displayName": "Figma",
  "version": "1.0.0",
  "description": "Figma design system integration: inspect design files, extract component trees, read design tokens, and convert designs into clean UI code.",
  "author": {
    "name": "FtAi Team / Figma"
  },
  "homepage": "https://figma.com",
  "skills": [
    "skills/figma-tokens"
  ],
  "locales": {
    "zh-CN": {
      "displayName": "Figma",
      "description": "Figma 设计稿解析与代码还原：提取设计 Token、组件树、布局约束并转换为 Tailwind CSS / Vue / React 代码。",
      "tags": [
        "figma",
        "设计稿",
        "ui设计",
        "设计规范",
        "tokens",
        "前端还原"
      ]
    },
    "en-US": {
      "displayName": "Figma",
      "description": "Figma design system integration: inspect design files, extract component trees, read design tokens, and convert designs into clean UI code.",
      "tags": [
        "figma",
        "design",
        "ui-ux",
        "tokens",
        "css"
      ]
    }
  }
}
